{"$schema":"https://json-schema.org/draft/2020-12/schema","type":"object","additionalProperties":false,"required":["cycle_id","active_batch","phase","intake_ids","prior_batch_verdict","improvement"],"properties":{"cycle_id":{"type":"string","pattern":"^system-one-cycle-"},"active_batch":{"type":"string","pattern":"^system-one-batch-"},"phase":{"const":"source-fragility-audit"},"intake_ids":{"type":"array","minItems":3,"maxItems":3,"uniqueItems":true,"items":{"type":"string","pattern":"^intake-"}},"prior_batch_verdict":{"const":"no-justified-trio"},"improvement":{"type":"string","minLength":50}}}
