{"cycle_id":"system-one-cycle-2","active_batch":"system-one-batch-2","phase":"source-fragility-audit","intake_ids":["intake-snow-occupancy","intake-frost-warming","intake-biodiversity-stability"],"prior_batch_verdict":"no-justified-trio","improvement":"Require claim-variable closure and a named distinct artifact before source-fragility audit, so a record that only repeats the published analysis is rejected before candidate construction."}
